{
  "$schema": "https://json-schema.org/draft/2020-12/schema",
  "type": "object",
  "properties": {
    "label": {
      "type": "string",
      "minLength": 1
    },
    "fields": {
      "minItems": 1,
      "type": "array",
      "items": {
        "type": "object",
        "properties": {
          "name": {
            "type": "string",
            "minLength": 1
          },
          "prompt": {
            "type": "string",
            "minLength": 1
          },
          "accepted": {
            "type": "array",
            "items": {
              "type": "string",
              "minLength": 1
            }
          }
        },
        "required": ["name", "prompt"]
      }
    },
    "revalidateAfterDays": {
      "type": "integer",
      "exclusiveMinimum": 0,
      "maximum": 9007199254740991
    },
    "profile": {
      "description": "About the user: every persona sees the answers, and asks for the first field while it's missing",
      "type": "boolean"
    }
  },
  "required": ["label", "fields"]
}
